{
  "$schema": "https://json-schema.org/draft/2020-12/schema",
  "$id": "https://wayd.dev/schemas/wayd-data/recipe.schema.json",
  "title": "wayd-data recipe",
  "description": "A named bundle of generation knobs for wayd-data. Every field is optional: what a recipe leaves out is taken from the recipe it extends, and an explicit command-line flag beats both.",
  "type": "object",
  "additionalProperties": false,
  "properties": {
    "$schema": {
      "type": "string",
      "description": "Points at this schema so an editor can complete and validate the file."
    },
    "version": {
      "type": "integer",
      "description": "The recipe format's version.",
      "minimum": 1
    },
    "extends": {
      "type": "string",
      "description": "A built-in recipe name or file path to start from. Anything stated here is layered over it."
    },
    "description": {
      "type": "string",
      "description": "A one-line summary, shown by `wayd-data recipes`."
    },
    "timeline": {
      "type": "object",
      "description": "When the run happens, and how far it reaches either side of that.",
      "additionalProperties": false,
      "properties": {
        "asOf": {
          "type": ["string", "null"],
          "format": "date",
          "description": "The date the run treats as today. Omit to anchor on the real one, so data straddles now. Pin it alongside --random-seed for byte-identical output.",
          "x-cli-flag": "--as-of"
        },
        "companyAgeYears": {
          "type": "integer",
          "description": "How far back the company's history reaches. Nothing is generated before this.",
          "minimum": 1,
          "x-cli-flag": "--company-age-years"
        },
        "teamStructureAgeYears": {
          "type": "integer",
          "description": "How long the current team structure has stood, which is shorter than the company's own age.",
          "minimum": 1,
          "x-cli-flag": "--team-structure-age-years"
        },
        "historyYears": {
          "type": "integer",
          "description": "How much delivery history sits behind asOf.",
          "minimum": 0,
          "x-cli-flag": "--history-years"
        },
        "runwayYears": {
          "type": "integer",
          "description": "How much planned work sits ahead of asOf.",
          "minimum": 0,
          "x-cli-flag": "--runway-years"
        }
      }
    },
    "organization": {
      "type": "object",
      "description": "The organization: people, teams, and the hierarchy over them.",
      "additionalProperties": false,
      "properties": {
        "enabled": {
          "type": "boolean",
          "description": "Whether the area is generated at all.",
          "x-cli-no-flag": "Cannot be false — every other area is generated over the organization — so there is nothing for a flag to express. Disable the other areas instead."
        },
        "companyType": {
          "enum": ["Tech", "Balanced", "Enterprise"],
          "description": "Sets the default share of employees inside the delivery structure (tech ~85%, balanced ~50%, enterprise ~20%).",
          "x-cli-flag": "--company-type"
        },
        "deliveryRatio": {
          "type": "number",
          "description": "Override for that share, when the company type's default is not wanted.",
          "minimum": 0,
          "maximum": 1,
          "x-cli-flag": "--delivery-ratio"
        },
        "valueStreams": {
          "type": "integer",
          "description": "Number of value streams (product lines).",
          "minimum": 1,
          "x-cli-flag": "--value-streams"
        },
        "teams": {
          "type": "integer",
          "description": "Number of leaf delivery teams.",
          "minimum": 1,
          "x-cli-flag": "--teams"
        },
        "valueStreamTier": {
          "enum": ["Auto", "On", "Off"],
          "description": "Whether a value stream gets a team of teams above its ARTs, led by a VP of Engineering and a VP of Product. Auto gives one only to a value stream with enough teams for two ARTs.",
          "x-cli-flag": "--value-stream-tier"
        },
        "artTier": {
          "enum": ["Auto", "On", "Off"],
          "description": "Whether teams are grouped into ARTs. Auto is on. Off puts each value stream's teams directly under its team of teams, or at the top of the hierarchy when it has none; they then plan, ship and take on projects as one group.",
          "x-cli-flag": "--art-tier"
        },
        "attritionRate": {
          "type": "number",
          "description": "Share of positions that change hands in a year, across the delivery history. Every leaver is replaced, so this adds former employees — including managers and people on delivery teams — without shrinking today's organization, and past work names whoever held a role at the time.",
          "minimum": 0,
          "maximum": 0.5,
          "x-cli-flag": "--attrition-rate"
        }
      }
    },
    "users": {
      "type": "object",
      "description": "The application roles and the sign-ins that hold them. Only people whose authorization differs get an account.",
      "additionalProperties": false,
      "properties": {
        "enabled": {
          "type": "boolean",
          "description": "Whether roles and accounts are created at all.",
          "x-cli-flag": "--skip-users",
          "x-cli-flag-negates": true
        },
        "password": {
          "type": "string",
          "description": "The password every generated account is created with. Must satisfy the password rules: at least 8 characters with an uppercase letter, a lowercase letter and a digit.",
          "minLength": 8,
          "x-cli-flag": "--user-password"
        }
      }
    },
    "ppm": {
      "type": "object",
      "description": "The portfolios, programs, projects and the work beneath them.",
      "additionalProperties": false,
      "properties": {
        "enabled": {
          "type": "boolean",
          "description": "Whether the area is generated at all.",
          "x-cli-flag": "--skip-ppm",
          "x-cli-flag-negates": true
        },
        "functionPortfolios": {
          "type": "integer",
          "description": "Cross-cutting business-function portfolios, in addition to one per value stream.",
          "minimum": 0,
          "x-cli-flag": "--function-portfolios"
        },
        "concurrentProjectsPerArt": {
          "type": "integer",
          "description": "Average number of projects an ART has in flight at once. The total generated is derived from this across the window.",
          "minimum": 1,
          "x-cli-flag": "--concurrent-projects-per-art"
        },
        "concurrentProgramsPerPortfolio": {
          "type": "integer",
          "description": "Average number of thematic programs a portfolio runs at once.",
          "minimum": 1,
          "x-cli-flag": "--concurrent-programs-per-portfolio"
        },
        "programs": {
          "enum": ["Auto", "On", "Off"],
          "description": "Whether value-stream portfolios group their projects into programs. Auto leaves about one project in six standalone; On places every project in a program whose window covers it; Off generates no programs.",
          "x-cli-flag": "--programs"
        }
      }
    },
    "productManagement": {
      "type": "object",
      "description": "The product catalog over the organization — a product line per value stream, a product per ART, a component per team — and how it ships: versions, release packages, releases and deployments.",
      "additionalProperties": false,
      "properties": {
        "enabled": {
          "type": "boolean",
          "description": "Whether the area is generated at all. Seeding it enables the product-management feature flag.",
          "x-cli-flag": "--skip-product-management",
          "x-cli-flag-negates": true
        },
        "versionIntervalDays": {
          "type": "integer",
          "description": "Average days between two versions of a service. Web apps ship less often, libraries and tools far less, and teams speed up across the history.",
          "minimum": 1,
          "maximum": 365,
          "x-cli-flag": "--version-interval-days"
        },
        "changeFailureRate": {
          "type": "number",
          "description": "Share of production deployments that fail or are rolled back, averaged over the history. Teams vary around it and it falls toward today.",
          "minimum": 0,
          "maximum": 0.6,
          "x-cli-flag": "--change-failure-rate"
        },
        "packagedArtFraction": {
          "type": "number",
          "description": "Share of ARTs that ship their services together as release packages rather than each deploying on its own. Any share above zero packages at least one ART.",
          "minimum": 0,
          "maximum": 1,
          "x-cli-flag": "--packaged-art-fraction"
        },
        "componentsPerTeam": {
          "type": "number",
          "description": "Average components each team owns and ships. 1.3 is about one deployable per team with the occasional library or tool; a microservice estate runs three to ten. Every component ships, so this also sizes the delivery history.",
          "minimum": 1.3,
          "maximum": 10,
          "x-cli-flag": "--components-per-team"
        },
        "dependencies": {
          "type": "boolean",
          "description": "Whether products record what they depend on: a few shared platform services most of the catalog relies on, a hub in each business line, chains across lines, and links that ended or changed strength over the history.",
          "x-cli-flag": "--skip-product-dependencies",
          "x-cli-flag-negates": true
        },
        "dependenciesPerComponent": {
          "type": "number",
          "description": "Average products each component depends on. Applications depend on more, libraries on almost nothing.",
          "minimum": 0.5,
          "maximum": 10,
          "x-cli-flag": "--dependencies-per-component"
        },
        "hardDependencyFraction": {
          "type": "number",
          "description": "Share of dependencies a product cannot work without. Each link leans from it by what it is: an application on its own backend is almost always hard, one on analytics usually soft.",
          "minimum": 0,
          "maximum": 1,
          "x-cli-flag": "--hard-dependency-fraction"
        },
        "platformServices": {
          "type": "integer",
          "description": "How many shared platform services — identity, the gateway, messaging — most of the catalog relies on. Omit to size it from the catalog, at about one service in forty.",
          "minimum": 0,
          "maximum": 24,
          "x-cli-flag": "--platform-services"
        }
      }
    },
    "planning": {
      "type": "object",
      "description": "The planning intervals each ART runs — quarterly, on a calendar every ART shares, rostered with the ART and its teams — and the objectives and risks its teams plan in them.",
      "additionalProperties": false,
      "properties": {
        "enabled": {
          "type": "boolean",
          "description": "Whether the area is generated at all.",
          "x-cli-flag": "--skip-planning",
          "x-cli-flag-negates": true
        },
        "iterationWeeks": {
          "type": "integer",
          "description": "Length of each iteration in a planning interval, in weeks. Intervals are quarterly — a year's four hold six, seven, six and seven two-week iterations — so this also sets how many iterations each holds.",
          "minimum": 1,
          "maximum": 4,
          "x-cli-flag": "--iteration-weeks"
        },
        "objectivesPerTeam": {
          "type": "integer",
          "description": "Average number of objectives a team commits to per planning interval, stretch objectives included.",
          "minimum": 1,
          "maximum": 10,
          "x-cli-flag": "--objectives-per-team"
        },
        "risksPerTeam": {
          "type": "number",
          "description": "Average number of risks a team raises per planning interval.",
          "minimum": 0,
          "maximum": 5,
          "x-cli-flag": "--risks-per-team"
        }
      }
    },
    "demandManagement": {
      "type": "object",
      "description": "The Request Desk: a product desk per value stream, an IT desk and a private Security and Compliance desk where the company has people to staff them, and the intake requests its departments submit to them over the history.",
      "additionalProperties": false,
      "properties": {
        "enabled": {
          "type": "boolean",
          "description": "Whether the area is generated at all.",
          "x-cli-flag": "--skip-demand-management",
          "x-cli-flag-negates": true
        },
        "requestsPerMonth": {
          "type": "integer",
          "description": "Average number of intake requests the company submits per month, spread across the history.",
          "minimum": 0,
          "maximum": 200,
          "x-cli-flag": "--requests-per-month"
        }
      }
    }
  }
}
