{
  "$schema": "https://wayd.dev/schemas/wayd-data/recipe.schema.json",
  "version": 1,
  "extends": "default",
  "description": "The organization on its own, with no PPM, Product Management, Planning or Request Desk dataset over it.",
  "ppm": {
    "enabled": false
  },
  "productManagement": {
    "enabled": false
  },
  "planning": {
    "enabled": false
  },
  "demandManagement": {
    "enabled": false
  }
}
