{
  "$schema": "https://wayd.dev/schemas/wayd-data/recipe.schema.json",
  "version": 1,
  "description": "A small tech company with a full four-year delivery window. What a run uses when no recipe is named.",
  "timeline": {
    "asOf": null,
    "companyAgeYears": 5,
    "teamStructureAgeYears": 2,
    "historyYears": 2,
    "runwayYears": 2
  },
  "organization": {
    "enabled": true,
    "companyType": "Tech",
    "valueStreams": 3,
    "teams": 18,
    "valueStreamTier": "Auto",
    "artTier": "Auto",
    "attritionRate": 0.1
  },
  "ppm": {
    "enabled": true,
    "functionPortfolios": 2,
    "concurrentProjectsPerArt": 10,
    "concurrentProgramsPerPortfolio": 5,
    "programs": "Auto"
  },
  "users": {
    "enabled": true,
    "password": "Test123$"
  },
  "productManagement": {
    "enabled": true,
    "versionIntervalDays": 14,
    "changeFailureRate": 0.12,
    "packagedArtFraction": 0.25,
    "componentsPerTeam": 1.3,
    "dependencies": true,
    "dependenciesPerComponent": 3.5,
    "hardDependencyFraction": 0.6
  },
  "planning": {
    "enabled": true,
    "iterationWeeks": 2,
    "objectivesPerTeam": 4,
    "risksPerTeam": 1.5
  },
  "demandManagement": {
    "enabled": true,
    "requestsPerMonth": 12
  }
}
