{
  "$schema": "https://wayd.dev/schemas/wayd-data/recipe.schema.json",
  "version": 1,
  "extends": "default",
  "description": "A young company: one product line, a handful of teams with no ART over them, and little history behind it.",
  "timeline": {
    "companyAgeYears": 2,
    "teamStructureAgeYears": 1,
    "historyYears": 1,
    "runwayYears": 1
  },
  "organization": {
    "valueStreams": 1,
    "teams": 4,
    "artTier": "Off",
    "attritionRate": 0.15
  },
  "ppm": {
    "functionPortfolios": 0,
    "concurrentProjectsPerArt": 4,
    "concurrentProgramsPerPortfolio": 2
  },
  "productManagement": {
    "versionIntervalDays": 7,
    "changeFailureRate": 0.15,
    "packagedArtFraction": 0
  },
  "planning": {
    "objectivesPerTeam": 3,
    "risksPerTeam": 1
  },
  "demandManagement": {
    "requestsPerMonth": 4
  }
}
