{
  "$schema": "https://wayd.dev/schemas/wayd-data/recipe.schema.json",
  "version": 1,
  "extends": "default",
  "description": "A large non-delivery-led business, where most of the headcount sits outside the delivery structure.",
  "timeline": {
    "companyAgeYears": 25,
    "historyYears": 3,
    "runwayYears": 2
  },
  "organization": {
    "companyType": "Enterprise",
    "valueStreams": 4,
    "teams": 30,
    "attritionRate": 0.08
  },
  "ppm": {
    "functionPortfolios": 5,
    "concurrentProjectsPerArt": 8
  },
  "productManagement": {
    "versionIntervalDays": 28,
    "changeFailureRate": 0.2,
    "packagedArtFraction": 0.6
  },
  "planning": {
    "risksPerTeam": 2.5
  },
  "demandManagement": {
    "requestsPerMonth": 40
  }
}
