{
  "$schema": "https://wayd.dev/schemas/wayd-data/recipe.schema.json",
  "version": 1,
  "extends": "default",
  "description": "A scaled product organization: several value streams, many teams, a dense portfolio, and a microservice catalog of a few hundred products with the dependencies between them.",
  "timeline": {
    "companyAgeYears": 12,
    "historyYears": 3,
    "runwayYears": 2
  },
  "organization": {
    "valueStreams": 6,
    "teams": 60
  },
  "ppm": {
    "functionPortfolios": 4,
    "concurrentProjectsPerArt": 12,
    "concurrentProgramsPerPortfolio": 6
  },
  "productManagement": {
    "versionIntervalDays": 21,
    "componentsPerTeam": 4
  }
}
